{
  "$schema": "https://web-harness.local/schemas/web-core/project-profile.schema.json",
  "schemaVersion": 1,
  "profileId": "vite-serverless-hybrid",
  "resolution": {
    "source": "detected",
    "requested": null,
    "detected": "vite-serverless-hybrid",
    "evidence": [
      "package:react",
      "package:vite",
      "path:api",
      "path:src/main.tsx",
      "path:vite.config.ts"
    ]
  },
  "adapter": {
    "id": "vite-serverless-hybrid",
    "version": "1.1.0",
    "sha256": "4b4400f4f6342cb44688b2ccc6b2cde5778213813a64a6a54e3970457e40e899",
    "supportLevel": "certified",
    "trustTier": "builtin"
  },
  "product": {"kind": "hybrid-web"},
  "frontend": {
    "framework": "react",
    "variant": "vite-serverless-hybrid",
    "router": "history-api",
    "rendering": ["csr"],
    "packageManager": "pnpm"
  },
  "backend": {"shape": "serverless-functions"},
  "runtime": {
    "primary": "browser",
    "supported": ["browser", "node", "node-build"]
  },
  "capabilities": [
    "client-routing",
    "csr",
    "serverless-functions",
    "static-build"
  ],
  "deployment": {
    "provider": "vercel",
    "availableProviders": ["vercel"],
    "target": "vercel-hybrid",
    "availableTargets": ["vercel-hybrid"],
    "releaseTarget": "release.vercel-hybrid",
    "artifacts": [
      {"id": "vite-dist", "path": "dist", "kind": "static-directory"}
    ]
  },
  "risk": {"level": "public"},
  "toolchain": {
    "nodeEngine": ">=22 <23",
    "packageManager": "pnpm@11.18.0",
    "packageDeclarations": {
      "react": "19.2.7",
      "vite": "8.1.4"
    },
    "exactFrameworkVersions": true
  }
}
